{
  "messageId": "msg-ifc-generate-001",
  "schemaVersion": "v1",
  "messageType": "COMMAND",
  "commandType": "IFC_GENERATE_FROM_BUBBLE",
  "routingKey": "command.ifc-generate.from-bubble",
  "jobId": "job-ifc-generate-001",
  "jobStepId": "job-step-ifc-generate-001",
  "stepNo": 1,
  "totalSteps": 2,
  "projectId": "project-layout-001",
  "requestedBy": "user-002",
  "sourceRevisionId": "rev-layout-source-001",
  "sourceSceneStateId": "layout-scene-001",
  "sourceSceneType": "LAYOUT_IMPORT",
  "targetRevisionId": "rev-layout-target-001",
  "expectedOutputArtifactId": "artifact-ifc-generate-001",
  "expectedOutput": {
    "ifcStorageUrl": "s3://batang-artifacts/projects/project-layout-001/revisions/rev-layout-target-001/model.ifc"
  },
  "payload": {
    "layoutImport": {
      "schema_version": "v2",
      "id": "550e8400-e29b-41d4-a716-446655440000",
      "name": "sample-project",
      "rooms": [
        {
          "id": "room-living-01",
          "name": "Living Room",
          "type": "living",
          "width": 4200,
          "height": 3800,
          "floor": 1,
          "x": 5000.0,
          "y": 4000.0,
          "angle": 0.0,
          "locked": false,
          "zoneId": "zone-common"
        },
        {
          "id": "room-bed-01",
          "name": "Bedroom",
          "type": "bedroom",
          "width": 3600,
          "height": 3200,
          "floor": 2,
          "x": 9000.0,
          "y": 4000.0,
          "angle": 0.0,
          "locked": false,
          "zoneId": "zone-common"
        }
      ],
      "zones": [
        {
          "id": "zone-common",
          "name": "Common",
          "color": "#FF5733"
        }
      ],
      "adjacency": [
        {
          "from_room_id": "room-living-01",
          "to_room_id": "room-bed-01",
          "strength": 0.6
        }
      ],
      "boundaries": [
        {
          "floor": 1,
          "polygon": [
            [0.0, 0.0],
            [4200.0, 0.0],
            [4200.0, 3800.0],
            [0.0, 3800.0]
          ]
        },
        {
          "floor": 2,
          "polygon": [
            [0.0, 0.0],
            [3600.0, 0.0],
            [3600.0, 3200.0],
            [0.0, 3200.0]
          ]
        }
      ],
      "generation_options": {
        "generate_spaces": true,
        "generate_walls": true,
        "generate_slabs": true,
        "generate_roof": true,
        "generate_openings": false
      },
      "modeling_defaults": {
        "space_height_mm": 2700,
        "wall_thickness_mm": 200,
        "slab_thickness_mm": 180,
        "roof_height_mm": 400
      },
      "generation_policy": {
        "boundary_wall_mode": "outer_boundary",
        "shared_wall_policy": "from_adjacency",
        "roof_shape": "flat"
      }
    }
  },
  "attemptNo": 0,
  "maxAttempts": 3,
  "idempotencyKey": "job-ifc-generate-001:1",
  "correlationId": "corr-ifc-generate-001",
  "createdAt": "2026-04-27T09:15:00Z"
}
