{
  "messageId": "msg-2d-001",
  "schemaVersion": "v1",
  "messageType": "COMMAND",
  "commandType": "TWO_D_LLM_GENERATE",
  "routingKey": "command.2d-llm.generate",
  "jobId": "job-2d-001",
  "jobStepId": "job-step-2d-001",
  "stepNo": 1,
  "totalSteps": 3,
  "projectId": "project-alpha",
  "requestedBy": "user-001",
  "sourceRevisionId": "rev-source-001",
  "sourceSceneStateId": "scene-state-001",
  "sourceSceneType": "SCENE_2D",
  "targetRevisionId": "rev-target-001",
  "expectedOutputArtifactId": "artifact-2d-plan-001",
  "input": {
    "sourceSceneStorageUrl": "s3://batang-artifacts/jobs/job-2d-001/steps/1/source-scene.json"
  },
  "expectedOutput": {
    "editPlanStorageUrl": "s3://batang-artifacts/jobs/job-2d-001/steps/1/edit-plan.json"
  },
  "payload": {
    "userInstruction": "거실과 주방을 더 가깝게 배치해줘",
    "sourceSceneStorageUrl": "s3://batang-artifacts/jobs/job-2d-001/steps/1/source-scene.json"
  },
  "attemptNo": 0,
  "maxAttempts": 3,
  "idempotencyKey": "job-2d-001:1",
  "correlationId": "corr-2d-001",
  "createdAt": "2026-04-27T09:00:00Z"
}
